{
  "$schema": "http://json-schema.org/draft-07/schema#",
  "title": "Workflow Outage",
  "type": "object",
  "properties": {
    "date": {"type": "string", "format": "date"},
    "workflow": {"type": "string"},
    "job": {"type": "string"},
    "run_id": {"type": "integer"},
    "run_url": {"type": "string", "format": "uri"},
    "root_cause": {"type": "string"},
    "resolution": {"type": "string"}
  },
  "required": [
    "date",
    "workflow",
    "job",
    "run_id",
    "root_cause",
    "resolution"
  ]
}
