{
  "$schema": "./schema.json",
  "date": "2025-08-22",
  "workflow": "Rebuild 3-D heat-map",
  "job": "heatmap",
  "run_id": 17145073802,
  "run_url": "https://github.com/futuroptimist/futuroptimist/actions/runs/17145073802",
  "root_cause": "workflow called 'uv pip' without installing uv",
  "resolution": "add astral-sh/setup-uv step before installing dependencies"
}
